{
  "schema_version": 1,
  "diagram_type": "flowchart",
  "meta": {
    "title": "Phone Order Flowchart",
    "subtitle": "DIN 66001 program flowchart — an AI phone agent ordering through /api/v1",
    "output": "examples/flowchart-order-call.html",
    "viewBox": [1120, 1420],
    "animation": "trace",
    "quality_profile": "showcase",
    "grid": { "colWidth": 176, "rowHeight": 88, "originX": 96, "originY": 84 },
    "views": [
      { "id": "happy-path", "label": "Happy path", "focus": ["start", "announce", "get_menu", "take_wish", "opening", "is_open", "delivery", "quote", "blockers", "read_total", "confirmed", "make_key", "post_order", "answered", "status", "read_number", "end_ok"], "note": "Follow the call from the first announcement to an order on the board." },
      { "id": "quote-loop", "label": "Quote loop", "focus": ["quote", "blockers", "read_blockers", "take_change"], "note": "Every change in the conversation is a new quote; blockers drive the questions." },
      { "id": "retry-and-exits", "label": "Retry and exits", "focus": ["post_order", "answered", "retry", "status", "alert_owner", "end_none"], "note": "The same idempotency key is resent after a timeout; 409 alerts the owner, 422 re-quotes." }
    ]
  },
  "groups": [
    { "id": "advise", "label": "A · Advise", "nodes": ["announce", "get_menu", "take_wish", "opening", "is_open", "read_hours"] },
    { "id": "calculate", "label": "B · Calculate", "nodes": ["quote", "blockers", "read_blockers", "take_change", "read_total", "confirmed"] },
    { "id": "order", "label": "C · Order", "nodes": ["make_key", "post_order", "answered", "retry", "status", "read_number", "alert_owner"] }
  ],
  "nodes": [
    { "id": "start", "symbol": "terminator", "label": "Call comes in", "col": 2, "row": 0 },
    { "id": "announce", "symbol": "process", "label": "Announce: a machine speaks", "sublabel": "AI Act Art. 50", "col": 2, "row": 1 },
    { "id": "get_menu", "symbol": "subroutine", "label": "GET /api/v1/menu", "col": 2, "row": 2 },
    { "id": "take_wish", "symbol": "io", "label": "Take wish: items, qty, mode, ZIP", "col": 2, "row": 3 },
    { "id": "opening", "symbol": "subroutine", "label": "GET /api/v1/opening-state", "col": 2, "row": 4 },
    { "id": "is_open", "symbol": "decision", "label": "Open?", "col": 2, "row": 5 },
    { "id": "read_hours", "symbol": "io", "label": "Read next opening time", "col": 4, "row": 5 },
    { "id": "delivery", "symbol": "decision", "label": "Delivery?", "col": 2, "row": 6 },
    { "id": "serviceability", "symbol": "subroutine", "label": "GET /api/v1/serviceability", "col": 0, "row": 6 },
    { "id": "in_zone", "symbol": "decision", "label": "ZIP in zone?", "col": 0, "row": 7 },
    { "id": "offer_pickup", "symbol": "io", "label": "Not deliverable, offer pickup", "col": 0, "row": 8 },
    { "id": "pickup_instead", "symbol": "decision", "label": "Pickup instead?", "col": 0, "row": 9 },
    { "id": "quote", "symbol": "subroutine", "label": "POST /api/v1/orders/quote", "col": 2, "row": 8 },
    { "id": "blockers", "symbol": "decision", "label": "Blockers empty?", "col": 2, "row": 9 },
    { "id": "read_blockers", "symbol": "io", "label": "Read blockers back", "col": 4, "row": 9 },
    { "id": "take_change", "symbol": "io", "label": "Take the change", "col": 4, "row": 8 },
    { "id": "read_total", "symbol": "io", "label": "Read total, ETA, terms", "col": 2, "row": 10 },
    { "id": "confirmed", "symbol": "decision", "label": "Confirmed?", "col": 2, "row": 11 },
    { "id": "make_key", "symbol": "process", "label": "Create idempotency key", "sublabel": "termsAcceptedAt", "col": 2, "row": 12 },
    { "id": "post_order", "symbol": "subroutine", "label": "POST /api/v1/orders", "col": 2, "row": 13 },
    { "id": "answered", "symbol": "decision", "label": "Answer received?", "col": 2, "row": 14 },
    { "id": "retry", "symbol": "process", "label": "Resend with same key", "col": 0, "row": 14 },
    { "id": "status", "symbol": "decision", "label": "Status?", "col": 2, "row": 15 },
    { "id": "read_number", "symbol": "io", "label": "Read order number", "col": 4, "row": 15 },
    { "id": "alert_owner", "symbol": "process", "label": "Alert the owner", "col": 0, "row": 15 },
    { "id": "end_ok", "symbol": "terminator", "label": "Order on the board", "col": 4, "row": 16 },
    { "id": "end_none", "symbol": "terminator", "label": "End without order", "col": 0, "row": 16 }
  ],
  "edges": [
    { "from": "start", "to": "announce" },
    { "from": "announce", "to": "get_menu" },
    { "from": "get_menu", "to": "take_wish" },
    { "from": "take_wish", "to": "opening" },
    { "from": "opening", "to": "is_open" },
    { "from": "is_open", "to": "read_hours", "label": "No" },
    { "from": "is_open", "to": "delivery", "label": "Yes" },
    { "from": "read_hours", "to": "end_none", "route": "right-channel", "channelX": 1040 },
    { "from": "delivery", "to": "serviceability", "label": "Yes" },
    { "from": "delivery", "to": "quote", "label": "No: pickup" },
    { "from": "serviceability", "to": "in_zone" },
    { "from": "in_zone", "to": "offer_pickup", "label": "No" },
    { "from": "in_zone", "to": "quote", "label": "Yes", "fromSide": "right", "toSide": "left", "route": "auto" },
    { "from": "offer_pickup", "to": "pickup_instead" },
    { "from": "pickup_instead", "to": "quote", "label": "Yes", "fromSide": "right", "toSide": "left" },
    { "from": "pickup_instead", "to": "end_none", "label": "No", "route": "left-channel", "channelX": 40 },
    { "from": "quote", "to": "blockers" },
    { "from": "blockers", "to": "read_blockers", "label": "No" },
    { "from": "read_blockers", "to": "take_change", "fromSide": "top", "toSide": "bottom" },
    { "from": "take_change", "to": "quote", "fromSide": "left", "toSide": "right", "variant": "dashed" },
    { "from": "blockers", "to": "read_total", "label": "Yes" },
    { "from": "read_total", "to": "confirmed" },
    { "from": "confirmed", "to": "end_none", "label": "No", "route": "left-channel", "channelX": 40 },
    { "from": "confirmed", "to": "make_key", "label": "Yes" },
    { "from": "make_key", "to": "post_order" },
    { "from": "post_order", "to": "answered" },
    { "from": "answered", "to": "retry", "label": "No: timeout" },
    { "from": "retry", "to": "post_order", "fromSide": "top", "toSide": "left", "variant": "dashed" },
    { "from": "answered", "to": "status", "label": "Yes" },
    { "from": "status", "to": "read_number", "label": "201 / 200" },
    { "from": "read_number", "to": "end_ok" },
    { "from": "status", "to": "alert_owner", "label": "409 conflict" },
    { "from": "status", "to": "quote", "label": "422 item gone", "route": "right-channel", "channelX": 1000, "variant": "dashed", "fromSide": "bottom", "toSide": "right" },
    { "from": "alert_owner", "to": "end_none" }
  ],
  "cards": [
    { "dot": "emerald", "title": "One rule", "items": ["The agent proposes, the domain decides: prices, zones, minimums and risk are computed only by the API.", "Every diamond reads what the previous API call returned — never the agent's own knowledge."] },
    { "dot": "amber", "title": "Two loops", "items": ["Quote loop: every change in the conversation is a new /orders/quote; blockers are the only source of questions.", "Retry loop: a timeout resends the same idempotency key — never a second pizza."] },
    { "dot": "rose", "title": "Exits", "items": ["409 conflict alerts the owner and ends without order.", "422 item gone returns to the quote with the item removed."] }
  ]
}
